{
	"schemaVersion": "image-production-assignment-v1",
	"assignmentId": "assignment-affinity-expansion-v1-web-caster-wind",
	"targetId": "affinity-expansion-v1-web-caster-wind",
	"skillVersion": "summonlab-image-production-v2",
	"assignedAt": "2026-08-30T20:00:00.000Z",
	"dryRun": false,
	"retryCeiling": 1,
	"permittedOutputs": {
		"candidatePath": "assets/enemies/experiments/affinity-expansion-v1/candidates/web-caster/wind-v1.png",
		"resultPath": "assets/enemies/experiments/affinity-expansion-v1/results/web-caster-wind-v1.json"
	},
	"forbiddenSharedPaths": [
		"assets/enemies/experiments/affinity-expansion-v1/manifest.json",
		"assets/enemies/experiments/affinity-expansion-v1/review/catalog.json",
		"assets/enemies/experiments/affinity-expansion-v1/review/blind-review.json",
		"assets/enemies/experiments/affinity-expansion-v1/review/evaluation.json",
		"assets/enemies/experiments/affinity-expansion-v1/generation-record.md"
	],
	"completionContract": {
		"oneTargetOneImage": true,
		"structuredResultRequired": true,
		"sharedFilesMustRemainUntouched": true,
		"selfPromotionForbidden": true
	}
}
