{
	"schemaVersion": "image-production-assignment-v1",
	"assignmentId": "assignment-affinity-workflow-v1-elemental-wood-v2",
	"targetId": "affinity-workflow-v1-elemental-wood-v2",
	"skillVersion": "summonlab-image-production-v1",
	"assignedAt": "2026-08-29T16:00:00.000Z",
	"dryRun": false,
	"retryCeiling": 1,
	"permittedOutputs": {
		"candidatePath": "assets/enemies/experiments/affinity-workflow-v1/candidates/regression/elemental/wood-v2.png",
		"resultPath": "assets/enemies/experiments/affinity-workflow-v1/results/regression/elemental-wood-v2.json"
	},
	"forbiddenSharedPaths": [
		"assets/enemies/experiments/affinity-workflow-v1/review/catalog.json",
		"assets/enemies/experiments/affinity-workflow-v1/review/blind-review.json",
		"assets/enemies/experiments/affinity-workflow-v1/review/evaluation.json",
		"assets/enemies/experiments/affinity-workflow-v1/review/contact-sheet.png",
		"assets/enemies/experiments/affinity-workflow-v1/generation-record.md"
	],
	"completionContract": {
		"oneTargetOneImage": true,
		"structuredResultRequired": true,
		"sharedFilesMustRemainUntouched": true,
		"selfPromotionForbidden": true
	}
}
